{
	"$schema": "https://json-schema.org/draft/2020-12/schema",
	"$id": "https://stackwarden.dev/schemas/governance-model.schema.json",
	"title": "StackWarden governance model source of truth",
	"type": "object",
	"required": [
		"$schema",
		"schemaVersion",
		"name",
		"sourceOfTruth",
		"generatedDocument",
		"purpose",
		"principles",
		"domains",
		"rules",
		"clientVocabulary"
	],
	"additionalProperties": false,
	"properties": {
		"$schema": { "type": "string" },
		"schemaVersion": { "const": 1 },
		"name": { "const": "stackwarden-governance-model" },
		"sourceOfTruth": { "type": "string" },
		"generatedDocument": { "type": "string" },
		"purpose": { "type": "string" },
		"principles": { "type": "array", "items": { "type": "string" }, "minItems": 1 },
		"domains": {
			"type": "array",
			"minItems": 1,
			"items": {
				"type": "object",
				"required": ["id", "label", "clientFiles", "checks", "brickSignals"],
				"additionalProperties": false,
				"properties": {
					"id": { "type": "string" },
					"label": { "type": "string" },
					"clientFiles": { "type": "array", "items": { "type": "string" } },
					"checks": { "type": "array", "items": { "type": "string" } },
					"brickSignals": { "type": "array", "items": { "type": "string" } }
				}
			}
		},
		"rules": {
			"type": "array",
			"minItems": 1,
			"items": {
				"type": "object",
				"required": ["id", "title", "level", "domain", "detects", "recommendation"],
				"additionalProperties": false,
				"properties": {
					"id": { "type": "string" },
					"title": { "type": "string" },
					"level": { "const": "brick" },
					"domain": { "type": "string" },
					"detects": { "type": "string" },
					"recommendation": { "type": "string" }
				}
			}
		},
		"clientVocabulary": {
			"type": "object",
			"required": ["sourceLayer", "projectionLayer", "qualityLayer", "agentLayer", "privateMethodologyPolicy"],
			"additionalProperties": false,
			"properties": {
				"sourceLayer": { "type": "string" },
				"projectionLayer": { "type": "string" },
				"qualityLayer": { "type": "string" },
				"agentLayer": { "type": "string" },
				"privateMethodologyPolicy": { "type": "string" }
			}
		}
	}
}
